<?xml version="1.0"?>
<!--
     builder version 2.0

-->
<xsd:schema
    xmlns="http://www.dynasol.nl/xmlns/mmbase-shorthand"
    xmlns:dt="http://www.mmbase.org/xmlns/datatypes"
    targetNamespace="http://www.dynasol.nl/xmlns/mmbase-shorthand"
    xmlns:xsd="http://www.w3.org/2001/XMLSchema"
    elementFormDefault="qualified"
    attributeFormDefault="unqualified"
    version="1.0"
    >
      <xsd:import
      namespace="http://www.mmbase.org/xmlns/datatypes"
      schemaLocation="http://www.mmbase.org/xmlns/datatypes.xsd"
      />
    
    
    
      <xsd:element name="application" >
      	<xsd:complexType>
      		<xsd:sequence>
      			<xsd:element ref="reldef" minOccurs="0" maxOccurs="unbounded"/>
      			<xsd:element ref="builder" minOccurs="1" maxOccurs="unbounded"/>
      		</xsd:sequence>
      		<xsd:attribute name="name" type="xsd:string" use="required"/>

			<xsd:attribute name="defaultlanguage" type="xsd:string" use="required"/>
			<xsd:attribute name="maintainer" type="xsd:string"/>
			<xsd:attribute name="description" type="xsd:string"/>
			<xsd:attribute name="version" type="xsd:double" />
			<xsd:attribute name="autodeploy" type="truefalse" />
			
      	</xsd:complexType>
      	
      </xsd:element>
      
      <xsd:element name="reldef">
      	<xsd:complexType>
      		<xsd:attribute name="role" type="xsd:string" use="required" />
      		<xsd:attribute name="unidirectional" type="xsd:string"/>
      		<xsd:attribute name="guiname" type="xsd:string"/>
      		<xsd:attribute name="builder" type="xsd:string"/>
      	</xsd:complexType>
      </xsd:element>
      
      <xsd:element name="builder">
      	<xsd:complexType>
      		<xsd:sequence>
    			<xsd:element ref="field" minOccurs="0" maxOccurs="unbounded"/>
    			<xsd:element ref="relation" minOccurs="0" maxOccurs="unbounded"/>
    			<xsd:element ref="function" minOccurs="0" maxOccurs="unbounded"/>
      		</xsd:sequence>
			<xsd:attribute name="name" type="xsd:string" use="required"/>
			<xsd:attribute name="searchage" type="xsd:positiveInteger"/>
			<xsd:attribute name="version" type="xsd:double"/>
			<xsd:attribute name="extends" type="xsd:string"/>
			<xsd:attribute name="create" type="truefalse"/>
			<xsd:attribute name="status" type="xsd:string"/>
			<xsd:attribute name="class" type="xsd:string"/>
			<xsd:attribute name="sname" type="xsd:string"/>
			<xsd:attribute name="pname" type="xsd:string"/>
      	</xsd:complexType>
      </xsd:element>
      
      <xsd:element name="field">
		<xsd:complexType>
			<xsd:sequence>
				<xsd:element ref="dt:datatype"     minOccurs="0" maxOccurs="unbounded"/>
			</xsd:sequence>
			<xsd:attribute name="name" type="xsd:string" use="required"/>
      		<xsd:attribute name="datatype" type="xsd:string" />
      		<xsd:attribute name="description" type="xsd:string"/>
      		<xsd:attribute name="guiname" type="xsd:string"/>
      		<xsd:attribute name="type" type="xsd:string"/>
      		<xsd:attribute name="editor">
      			<xsd:simpleType>
      			<xsd:restriction base="xsd:string">
      				<xsd:pattern value="[isl]{1,3}" />
      			</xsd:restriction>
      		</xsd:simpleType>
      		</xsd:attribute>
      		<xsd:attribute name="flags">
      		<xsd:simpleType>
      			<xsd:restriction base="xsd:string">
      				<xsd:pattern value="[nk]{1,2}" />
      			</xsd:restriction>
      		</xsd:simpleType>
      		</xsd:attribute>
      		<xsd:attribute name="input" type="xsd:integer"/>
      		<xsd:attribute name="search" type="xsd:integer"/>
      		<xsd:attribute name="list" type="xsd:integer"/>
      		<xsd:attribute name="state" type="xsd:string"/>
      		<xsd:attribute name="size" type="xsd:integer"/>
		</xsd:complexType>
      </xsd:element>
      
	  <xsd:element name="relation">
	  	<xsd:complexType>
	  		<xsd:attribute name="role" type="xsd:string" use="required"/>
	  		<xsd:attribute name="target" type="xsd:string" use="required"/>
	  	</xsd:complexType>
	  </xsd:element>	
      
      <xsd:element name="function">
	  	<xsd:complexType>
	  		<xsd:attribute name="name" type="xsd:string" use="required"/>
	  		<xsd:attribute name="class" type="xsd:string" use="required"/>
	  		<xsd:attribute name="key" type="xsd:string"/>
	  	</xsd:complexType>
	  </xsd:element>		
	  
    <xsd:complexType name="application"></xsd:complexType>

    <xsd:simpleType name="truefalse">
		<xsd:restriction base="xsd:string">
        	<xsd:enumeration value="true" />
            <xsd:enumeration value="false" />
         </xsd:restriction>
    </xsd:simpleType>
</xsd:schema>
